{
  "id": "pdl-motion",
  "userId": "user-1",
  "createdAt": "2026-09-05T07:00:00.000Z",
  "paddledAt": "2026-09-05T06:00:00.000Z",
  "source": {
    "type": "device",
    "deviceId": "a1b2c3d4e5f6",
    "deviceSessionId": "S0013",
    "deviceName": "paddle01"
  },
  "doubleStrokeRate": false,
  "note": "",
  "insight": "A steady 0-min paddle at about 2:45/500, 64 spm. No stops.",
  "result": {
    "durationS": 19,
    "distanceKm": 0,
    "avgSpeed": 2.9127939679255235,
    "avgSR": 63.5,
    "avgDps": 2.7527080201041185,
    "srCv": 1.7606834468502282,
    "cruiseSpeed": 3.0269791402084816,
    "strokeRateDoubled": false,
    "points": [
      {
        "t": 0,
        "lat": 51.456027,
        "lng": -0.969,
        "speed": 2.274,
        "sr": 62,
        "dps": 2.201
      },
      {
        "t": 1,
        "lat": 51.456054,
        "lng": -0.968993,
        "speed": 2.425,
        "sr": 63,
        "dps": 2.31
      },
      {
        "t": 2,
        "lat": 51.456081,
        "lng": -0.968987,
        "speed": 2.526,
        "sr": 64,
        "dps": 2.369
      },
      {
        "t": 3,
        "lat": 51.456108,
        "lng": -0.96898,
        "speed": 2.598,
        "sr": 65,
        "dps": 2.399
      },
      {
        "t": 4,
        "lat": 51.456135,
        "lng": -0.968973,
        "speed": 3.031,
        "sr": 62,
        "dps": 2.934
      },
      {
        "t": 5,
        "lat": 51.456162,
        "lng": -0.968967,
        "speed": 3.031,
        "sr": 63,
        "dps": 2.887
      },
      {
        "t": 6,
        "lat": 51.456189,
        "lng": -0.96896,
        "speed": 3.031,
        "sr": 64,
        "dps": 2.841
      },
      {
        "t": 7,
        "lat": 51.456216,
        "lng": -0.968954,
        "speed": 3.03,
        "sr": 65,
        "dps": 2.797
      },
      {
        "t": 8,
        "lat": 51.456243,
        "lng": -0.968947,
        "speed": 3.03,
        "sr": 62,
        "dps": 2.932
      },
      {
        "t": 9,
        "lat": 51.456269,
        "lng": -0.968941,
        "speed": 3.029,
        "sr": 63,
        "dps": 2.885
      },
      {
        "t": 10,
        "lat": 51.456296,
        "lng": -0.968935,
        "speed": 3.028,
        "sr": 64,
        "dps": 2.839
      },
      {
        "t": 11,
        "lat": 51.456323,
        "lng": -0.968928,
        "speed": 3.028,
        "sr": 65,
        "dps": 2.795
      },
      {
        "t": 12,
        "lat": 51.45635,
        "lng": -0.968922,
        "speed": 3.027,
        "sr": 62,
        "dps": 2.929
      },
      {
        "t": 13,
        "lat": 51.456377,
        "lng": -0.968916,
        "speed": 3.026,
        "sr": 63,
        "dps": 2.882
      },
      {
        "t": 14,
        "lat": 51.456404,
        "lng": -0.96891,
        "speed": 3.025,
        "sr": 64,
        "dps": 2.836
      },
      {
        "t": 15,
        "lat": 51.456431,
        "lng": -0.968904,
        "speed": 3.024,
        "sr": 65,
        "dps": 2.792
      },
      {
        "t": 16,
        "lat": 51.456458,
        "lng": -0.968898,
        "speed": 3.023,
        "sr": 62,
        "dps": 2.926
      },
      {
        "t": 17,
        "lat": 51.456485,
        "lng": -0.968893,
        "speed": 3.023,
        "sr": 63,
        "dps": 2.879
      },
      {
        "t": 18,
        "lat": 51.456512,
        "lng": -0.968887,
        "speed": 3.022,
        "sr": 64,
        "dps": 2.833
      },
      {
        "t": 19,
        "lat": 51.456539,
        "lng": -0.968882,
        "speed": 3.022,
        "sr": 65,
        "dps": 2.789
      }
    ],
    "stops": [],
    "surges": [],
    "sets": [],
    "insight": "A steady 0-min paddle at about 2:45/500, 64 spm. No stops.",
    "noGps": {
      "reason": {
        "kind": "gps_lost",
        "lostAfterS": 19,
        "recordedS": 2400
      },
      "strokes": 2310
    }
  },
  "boatClass": "2X",
  "seat": "C"
}
